{
  "$schema": "https://json-schema.org/draft/2020-12/schema",
  "title": "Natural Capital",
  "type": "object",
  "required": ["year", "title", "categories", "clusters"],
  "properties": {
    "year": { "type": "integer", "minimum": 1900 },
    "title": { "type": "string", "minLength": 1 },
    "categories": {
      "type": "array",
      "minItems": 1,
      "items": {
        "type": "object",
        "required": ["id", "label", "unit", "provision", "usage"],
        "properties": {
          "id": { "type": "string", "minLength": 1 },
          "label": { "type": "string", "minLength": 1 },
          "unit": { "type": "string", "minLength": 1 },
          "provision": { "type": "number", "minimum": 0 },
          "usage": {
            "type": "object",
            "minProperties": 1,
            "additionalProperties": {
              "type": "number",
              "minimum": 0
            }
          }
        },
        "additionalProperties": false
      }
    },
    "clusters": {
      "type": "object",
      "minProperties": 1,
      "additionalProperties": { "type": "string" }
    },
    "metadata": {
      "type": "object",
      "properties": {
        "dataSource": { "type": ["string", "null"] },
        "notes": { "type": ["string", "null"] }
      },
      "additionalProperties": false
    }
  },
  "additionalProperties": false
}
